video_url,user_url,username,title,view_num,created_at,shortdesc,collected_at
/watch?v=8cF442d-EdQ&pp=ygULcmVtb3RlIHdvcms%3D,/@TED,TED,Is Remote Work Better Than Being in the Office? It's Complicated | Mark Mortensen | TED,178K,2 years,Opinions about remote work are plentiful and conflicting -- but what does the research say? Organizational design expert Mark ...,22:12.0
/watch?v=MQpotNI5NvQ&pp=ygULcmVtb3RlIHdvcms%3D,/@TEDx,TEDx Talks,How To Travel & Work Remotely Forever | Mike Swigunski | TEDxVake,176K,1 year,"Join Mike Swigunski, remote work and travel expert, as he shares the incredible journey of working and traveling across 100+ ...",22:12.0
/watch?v=IMgFGQ5G31Y&pp=ygULcmVtb3RlIHdvcms%3D,/@iris-tabea,Iris Tabea,How to find remote jobs with no experience | work remotely in 2026 👩🏻‍💻🌴,203K,1 year,Start a FREE Introduction Course with CourseCareers Now: https://coursecareers.com/a/iristabea Surf Code Sleep T-shirts (and ...,22:12.0
/watch?v=2mHP39ldaM0&pp=ygULcmVtb3RlIHdvcms%3D,/@CNAInsider,CNA Insider,How My Fully Remote Job Saves Money And Offers The Best Work-Life Balance | Money Mind | Remote Work,56K,9 months,"According to a recent survey, almost two thirds of young people in Southeast Asia and Hong Kong are willing to work a remote job ...",22:12.0
/watch?v=_xHQWLjE6xQ&pp=ygULcmVtb3RlIHdvcms%3D,/@TEDx,TEDx Talks,Remote work is effective—why the RTO mandates? | Heejung Chung | TEDxLondonBusinessSchool,29K,2 weeks,"From ""slacker"" stereotypes to return-to-office mandates, why does working from home still trigger so much suspicion? In this ...",22:12.0
/watch?v=13TDW5hG3Q4&pp=ygULcmVtb3RlIHdvcms%3D,/@thenataliedawson,Natalie Dawson,Why Remote Work Isn't Working Anymore,23K,7 months,"Remote work isn't just changing the way we work—it's quietly killing your career momentum, company culture, and long-term job ...",22:21.1
/watch?v=It3zSuK2w88&pp=ygULcmVtb3RlIHdvcms%3D,/@IAllegedly,I Allegedly,Remote Work is A SCAM! - Here is the PROOF,28K,6 months,"Remote work is ruining productivity! In this video, I break down why remote work might just be the biggest scam of our time.",22:21.1
/watch?v=mxpnk6F2EXc&pp=ygULcmVtb3RlIHdvcms%3D,/@CNBC,CNBC,Is The Golden Age Of Remote Work Over?,1.1M,2 years,Finding fully remote work is getting challenging. ​​New research from Indeed found that job postings are declining faster in ...,22:21.1
/watch?v=UHz5IIadnEQ&pp=ygULcmVtb3RlIHdvcmvSBwkJTwoBhyohjO8%3D,/@CNBCMakeIt,CNBC Make It,Why Corporate America Is Abandoning Remote Work,203K,9 months,"In the years following the pandemic, remote work became the new normal, but that's not the case anymore. Companies like AT&T ...",22:21.1
/watch?v=kkKQll4j4tw&pp=ygULcmVtb3RlIHdvcms%3D,/@GoingFartherTogether,GoingFartherTogether,15 Companies ALWAYS Hiring Remote Workers (No Experience Required),183K,2 months,"These are real opportunities where you can start building your career, even if you're new to the remote work world. We'll also talk ...",22:21.1
/shorts/V2regxpMVpw,/@EdwardSo,Edward So,That one Mf who works a remote job,2.8M,1 year,Mfs everywhere but home doing work.,22:21.1
/watch?v=eCRVoXbkHnw&pp=ygULcmVtb3RlIHdvcms%3D,/@BBCWorldService,BBC World Service,"What is the future of working from home? - The Global Story podcast, BBC World Service",1.7M,11 months,Many companies are bringing staff back into the office for more or all of the working week. Click here to subscribe to our channel ...,22:21.1
/watch?v=lcP8afb2PXs&pp=ygULcmVtb3RlIHdvcms%3D,/@raimeetravels,Raimee Travel,How to get a FULLY REMOTE job in 2025 + MY remote work story,69K,9 months,IT IS TIME! I'm sharing my full remote work journey and my tips to help you secure YOUR first (or next) remote job! I'll also be ...,22:21.1
/shorts/KaPbM9VO2ww,/@harshhhgautam,Harsh Gautam,How to find 100% Remote Jobs Online #remotework,375K,7 months,"Learn how to find 100% remote jobs online with this easy-to-follow guide. Discover the best websites, tools, and tips to land ...",22:21.1
/shorts/TeZJMQKBQCI,/@CalebHammer,Caleb Hammer,I Secretly Had 2 Remote Jobs at The Same Time 🤫,2.4M,8 months,Okay... I need to call the husband and get them to confront the truth. Watch here: ...,22:21.2
/watch?v=kJb-tAi8YO4&pp=ygULcmVtb3RlIHdvcms%3D,/@eggysteven,Eggy Steven,I Spent MONTHS Researching Remote Job Sites. Here Are The 15 BEST,27K,4 months,"A good remote job platform should have clear filters for remote work, updated listings, salary details when possible, and the right ...",22:21.2
/watch?v=JEZyQYbB55Y&t=363s&pp=ygULcmVtb3RlIHdvcms%3D,/@marktilbury,Mark Tilbury,7 Boring But High Paying Remote Jobs (Always Hiring in 2026),1.3M,4 months,https://www.youtube.com/watch?v=6zb99U-_43M Get Odoo for free here today: https://www.odoo.com/r/ctQv To get free fractional ...,22:21.2
/shorts/MIUSzCOaSI0,/@work2remotejobs,Work 2 Remote Jobs - How to Be Overemployed,"$550,000 Working 2 Remote Jobs (overemployed) #remotework #overemployment #makemoneyonline",69K,2 years,[FREE WEBINAR] How to Land More Remote Job Interviews in JUST 14 Days: https://www.work2remotejobs.com/ltowebinaryto ...,22:21.2
/shorts/Phgug_o8xIY,/@homesourcestaffing,Tomeka | Homesource Staffing,Best Remote Jobs For Beginners💻🏡,305K,1 year,#workfromhome #legitworkfromhome #remotework #remotejobs #wfh #wfhmom #stayathomemom #sahm ...,22:27.8
/watch?v=gtFYXBNgZzA&pp=ygULcmVtb3RlIHdvcmvSBwkJTwoBhyohjO8%3D,/@TwoCentsPBS,Two Cents,Is Remote Work Good for Me?,96K,1 year,SUPPORT us on PATREON: https://www.patreon.com/twocentspbsds SUBSCRIBE to Two Cents! https://goo.gl/jQ857H The ...,22:27.8
/watch?v=-JQKYzcmhyQ&pp=ygULcmVtb3RlIHdvcms%3D,/@SMN,Some More News,The REAL Reasons CEOs Hate Remote Work - SOME MORE NEWS,774K,11 months,"Hi. We've been told that 2025 is the year that remote working will die, despite it often being good for workers and their employers.",22:27.8
/shorts/XqwM0RESuwI,/@marktilbury,Mark Tilbury,HIGH-PAYING Remote Jobs Without a Degree 🤑,1.6M,4 months,Five high paid but boring remote jobs one a short form strategist 48k per year two a customer service coordinator 65k per year ...,22:27.8
/watch?v=aUNxhWQ4JYc&pp=ygULcmVtb3RlIHdvcms%3D,/@charlimarieTV,CharliMarieTV,Working remotely for a US company from Europe 🇺🇸🇪🇺 [How it works],89K,2 years,"Being from New Zealand, living in Europe, and working for a US tech company... It's definitely a complicated situation! I'm running ...",22:27.8
/watch?v=D69z_JDFUxw&pp=ygULcmVtb3RlIHdvcms%3D,/@Fafie3WFHJobs,Fafie 3 WFH Jobs,Remote Jobs for Africans | No Experience | Beginner Friendly | USD Pay!,195K,1 month,"Want to start working remote based anywhere in the world but don't have experience? In today's video, I'm sharing real remote ...",22:27.8
/watch?v=8kg4NNiOcxU&pp=ygULcmVtb3RlIHdvcms%3D,/@CBCTheNational,CBC News: The National,"Amazon ends remote work, and some employees aren’t happy",70K,1 year,"Amazon is one of the most high-profile companies to roll back remote work entirely, but some of its employees are unhappy with ...",22:27.8
/watch?v=AGYd9bZIYcM&pp=ygULcmVtb3RlIHdvcms%3D,/@Fads,Fads,Companies 'Declared War' On Remote Work. The Backlash Was Insane..,23K,5 months,yapping about RTO -- ▷ Other links: Patreon - https://www.patreon.com/Fads Twitch - https://www.twitch.tv/whoisfads Instagram ...,22:27.8
/watch?v=xcFKqgjtLMk&t=87s&pp=ygULcmVtb3RlIHdvcms%3D,/@RemotelyKat,Kat Lewis,These Remote Jobs Will Give You Equipment And Training (& An Easy WFH Job - No Experience Needed),3.5K,1 month,"Today, I'm sharing two remote jobs that will provide equipment AND train you. I'm also adding in a no-experience-needed work ...",22:27.8
/watch?v=9_7e80f1Ulk&pp=ygULcmVtb3RlIHdvcms%3D,/@loewhaley,LoeWhaley,Tips on Working Remote!,53K,1 year,... a space in your home or your remote work setup that is just for work at least when I started working from home I was like this is.,22:27.8
/watch?v=9Sz8i2PSLk4&t=17s&pp=ygULcmVtb3RlIHdvcms%3D,/@RemotelyKat,Kat Lewis,9 Remote Jobs You've Been Looking For,2.9K,1 month,"Today, I'm sharing a variety of remote jobs you've been asking for, including entry-level tech support/helpdesk jobs and ...",22:27.8
/watch?v=mhnDoQE0cxg&pp=ygULcmVtb3RlIHdvcms%3D,/@JustJobsToday,Just Jobs Today,5 Remote Jobs for Seniors #workfromhome #remotework,1.6K,2 months,"5 Remote Jobs for Seniors #wfhjobs #remotejobs2025 Please like, comment, share and subscribe for more remote jobs. Use this ...",22:27.8
/watch?v=B31P1ajRm_8&pp=ygULcmVtb3RlIHdvcms%3D,/@work_from_homies,Work From Homies,USPS is Hiring Remote + NO Remote Experience + No Phone Work From Home Jobs 2025/2026,4.4K,1 month,Today I'm going to show you Secret remote jobs at USPS in addition to 3 bonus remote jobs at other companies. Most of these ...,22:27.8
/watch?v=d1lKxMaivJw&pp=ygULcmVtb3RlIHdvcms%3D,/@TalkToRaye,Raye,Getting Into Remote Work - Real Talk With Professionals,9.3K,Streamed 2 months,Thinking about starting or advancing your remote work career but not sure how? Join vSavvy Academy for a free workshop ...,22:27.8
/watch?v=6ILbFfVLnDU&pp=ygULcmVtb3RlIHdvcms%3D,/@JooseTheNomad,Joose the Nomad,5 Best REMOTE Jobs to Become a DIGITAL NOMAD,103K,1 year,Want to become a digital nomad within a few months? This is how! ‍   Go to https://HOSTINGER.COM/JOOSE and use code ...,22:27.8
/watch?v=Zhhir6xPLw8&pp=ygULcmVtb3RlIHdvcms%3D,/@DianHuang,Dian Huang,How to Get Remote Job with No Experience in 2025 |,24K,10 months,Step by Step on How to Get a Remote Job and Travel https://payhip.com/b/XYJ8M Free Digital Marketing Masterclass ...,22:27.8
/watch?v=oqpNfu5Oyt4&pp=ygULcmVtb3RlIHdvcmvSBwkJTwoBhyohjO8%3D,/@RemotelyKat,Kat Lewis,Work From Home Jobs For Introverts (Mainly Non-Phone Remote Jobs),3.2K,1 month,"Looking for an introvert-friendly work from home job ? Here are three opportunities for you, including a trust & safety/moderation ...",22:27.8
/watch?v=Rq6LyKVt-s4&pp=ygULcmVtb3RlIHdvcms%3D,/@DelilahBell,Delilah Bell,🌟 NEED A REMOTE JOB? 3 Work From Home Jobs - Training Starts January 2026,8.1K,2 months,NEED A WFH RESUME? $1 Software Trial https://www.remoteworklife.co/remote-resume-builder-software-trial 00:00 - Intro ...,22:27.8
/shorts/4cQ5X_w0neo,/@CodingInspiration,Coding Inspiration,Best Remote Job Websites in 2025 #viral #trending #remotework,17K,8 months,"Best Remote Job Websites 2025 #viral #trending #remotework best remote jobs, digital nomad lifestyle, freelance gigs, freelance ...",22:27.8
/watch?v=lYaJjTU9pJ0&pp=ygULcmVtb3RlIHdvcms%3D,/@WhitneyBonds,Whitney Bonds,4 Legitimate Remote Jobs for People Looking to Work from Home in 2026,13K,1 month,"To apply for the Telehealth Registered Dietitian role, click here ...",22:35.4
/watch?v=kDTuDiYP1EE&pp=ygULcmVtb3RlIHdvcms%3D,/@JazzyMac,Life With Jazzy Mac,6 Easy Lazy Remote Jobs | Laptop and Training Provided!,90K,2 months,"[GRAB YOUR RESUME TEMPLATES HERE:] ‍   https://www.paybump.com/youtube If the role is NOT listed, that ...",22:35.4
/watch?v=7-y3Asx9EVs&pp=ygULcmVtb3RlIHdvcms%3D,/@TheWFHChannel,The Work From Home Channel,NEED A REMOTE JOB? 5 Work From Home Jobs Hiring Now (Entry Level 2026),116,6 hours,"FREE ATS Remote Resume Starter Kit https://cressida-media-llc.kit.com/freeatstemplate If you're applying to remote jobs, this ...",22:35.4
/watch?v=CehOcq2MAhQ&pp=ygULcmVtb3RlIHdvcms%3D,/@JuddAlbring,Judd Albring,Make $60/HR Working From Home Simply Repeating Words (NO Degree!),969K,10 months,Start your remote job career the modern way with CourseCareers FREE intro training - https://go.juddalbring.com/coursecareers ...,22:35.4
/watch?v=VwjKLGyMbi8&pp=ygULcmVtb3RlIHdvcms%3D,/@GoingFartherTogether,GoingFartherTogether,6 EASY Remote Jobs That Are Hiring With No Experience!,115K,3 months,OUR REMOTE WORK KEY https://gum.co/u/fsyboeuo FREE REMOTE WORK GUIDE: https://gum.co/u/vsha3ojm Looking to ...,22:35.4
/shorts/5iFqFPT8Z5A,/@rroomfies,Jane 🦧,I 🫶 my lazy remote job!!! Day in the life as Sunday shift worker at a remote call centre,224K,2 months,"... service representative $18.90/hr plus commission, so like ~$40-45k/yr#dayinthelife #workfromhome #remotework #lazygirljobs.",22:35.4
/watch?v=ww8ktyiRKkg&pp=ygULcmVtb3RlIHdvcms%3D,/@financialaffairswithnosipho,Financial Affairs With Nosipho,Remote Company Hiring Worldwide,40K,2 months,"Finding a job these days isn't easy. You may want something that pays the bills, but also gives you the flexibility to actually live life.",22:35.4
/watch?v=_6vRyQ6sKUU&pp=ygULcmVtb3RlIHdvcms%3D,/@CodieSanchezCT,Codie Sanchez,7 Remote Jobs You Can Do From Home,764K,11 months,"Thanks to Fundrise Flagship Fund for sponsoring this video! Carefully consider the investment objectives, risks, charges and ...",22:35.4
/watch?v=hb23WyxE5yw&pp=ygULcmVtb3RlIHdvcms%3D,/@DelilahBell,Delilah Bell,🌟 NEED A REMOTE JOB? 5 Online Work From Home Jobs (Entry Level),4.5K,7 days,NEED A WFH RESUME? $1 Software Trial https://www.remoteworklife.co/remote-resume-builder-software-trial 00:00 - Intro 00:35 ...,22:35.4
/watch?v=BRAGmvKcvCI&pp=ygULcmVtb3RlIHdvcms%3D,/@JazzyMac,Life With Jazzy Mac,Secret High Paying WFH Jobs Nobody Talks About,33K,13 days,"GRAB THE RESUME TEMPLATES HERE: ‍   https://www.paybump.com/youtube   If the role is NOT listed, it means it ...",22:35.4
/watch?v=OTrSB5ONfnI&pp=ygULcmVtb3RlIHdvcms%3D,/@theremotechic,The Remote Chic,Remote Job Sites | Where Africans Are REALLY Getting Remote Jobs (No Gatekeeping!),55K,7 months,"Whether you're just starting out or already job-hunting, these resources will help you land remote work from anywhere on the ...",22:35.4
/watch?v=EGL5v3jEepI&pp=ygULcmVtb3RlIHdvcms%3D,/@WhitneyBonds,Whitney Bonds,5 No Interview Remote Jobs You Can Start Today!,314K,9 months,If you're looking for 6-7 Figure Business ideas click here - https://business-expedited.kit.com/9b576d8123 Your first $1000 ...,22:35.4
/watch?v=6Ld2-LN7K1g&pp=ygULcmVtb3RlIHdvcms%3D,/@RemotelyKat,Kat Lewis,REMOTE JOBS YOU'VE BEEN LOOKING FOR (Availalbe Today),3.1K,2 weeks,"Today we're all about work from home jobs you've been asking for, including jobs that will train you, (one is part time), remote jobs ...",22:35.4
/watch?v=xq1VHZ2BF40&pp=ygULcmVtb3RlIHdvcmvSBwkJTwoBhyohjO8%3D,/@MrJustinBryant,Justin Bryant,3 Remote Companies Hiring for Around 400 Work From Home Jobs,3.2K,2 months,"LEARN MORE & APPLY HERE: https://selfmadesuccess.com/400-wfh-jobs-102125/ NOTE: IF THE JOB IS UNAVAILABLE, YOU ...",22:35.4
/watch?v=ggiEY08TrGk&pp=ygULcmVtb3RlIHdvcms%3D,/@ShaneHummus,Shane Hummus,7 SIMPLE But STABLE Remote Jobs (No Technical Skills Needed),136K,8 months,Coursera Online Courses: https://imp.i384100.net/Try-Coursera LIVE YOUTUBE TRAINING TUESDAY: ...,22:35.4
/watch?v=QVWvWMQEFC0&pp=ygULcmVtb3RlIHdvcms%3D,/@RemotelyKat,Kat Lewis,8 LEGITIMATE Work From Home Jobs Up For Grabs,3.9K,7 days,"if you're looking for a work from home job , here are 8 positions currently hiring: A part time work from home job, some that are ...",22:35.4
/watch?v=qP_u5vUxi8A&t=669s&pp=ygULcmVtb3RlIHdvcms%3D,/@MrJustinBryant,Justin Bryant,4 Remote Jobs No Experience Required Hiring Now,5.5K,2 months,"While many of these roles offer remote work and may require little to no prior experience, specific job responsibilities, ...",22:35.4
/watch?v=okh85F29Gjg&t=81s&pp=ygULcmVtb3RlIHdvcms%3D,/@harkirat1,Harkirat Singh,Complete Remote Job Primer - How to apply for jobs 2025-26,98K,2 months,"In this video, Kirat shares his experience of hiring with various companies. Having referred hundreds of people to different ...",22:35.4
/watch?v=f8BHAEmGROg&pp=ygULcmVtb3RlIHdvcms%3D,/@JazzyMac,Life With Jazzy Mac,Remote Jobs ALWAYS HIRING | Work From Anywhere 2025,100K,6 months,"[GRAB YOUR RESUME TEMPLATES HERE:] ‍   https://www.paybump.com If the role is NOT listed, that means it is ...",22:35.4
/watch?v=1hi3dIFOT1Q&pp=ygULcmVtb3RlIHdvcms%3D,/@bystadium,Stadium | SnackMagic | SwagMagic,JP Morgan's Declaring WAR Against Remote Work,9,8 hours,Stop losing great people. Stadium automates recognition so good work never goes unnoticed and keeps your team motivated: ...,22:43.3
/watch?v=lehUupehhno&pp=ygULcmVtb3RlIHdvcms%3D,/@JazzyMac,Life With Jazzy Mac,Work From Home Remote Jobs | Hiring Now Laptop Provided,50K,4 months,GRAB THE RESUME TEMPLATES & JOB LINKS HERE:] https://www.paybump.com/youtube [INTERVIEW PREP VIDEO] ...,22:43.3
/watch?v=ODv2MCpUZBA&pp=ygULcmVtb3RlIHdvcms%3D,/@RealHomeJobsNow,Real Home Jobs Now,🚨4 Remote Jobs Hiring Now and Starting SOON! | PAID TRAINING | Work From Home Jobs 2026,31K,3 weeks,Real Home Jobs Now Merch Is Available Now! http://realhomejobsnow-shop.fourthwall.com/ Today I'm sharing more great remote ...,22:43.3
/watch?v=I1poaaKtFck&pp=ygULcmVtb3RlIHdvcms%3D,/@TheRemoteTimes,The Remote Times,Work From HOME Remote Jobs NO INTERVIEW No Experience Set Your Own Schedule,40K,7 months,"Companies with work from home opportunities. No interview, No experience and No degree required. Plus, a bonus work from ...",22:43.3
/watch?v=7EkeBaAB5mc&pp=ygULcmVtb3RlIHdvcms%3D,/@RealHomeJobsNow,Real Home Jobs Now,5 EASY NO PHONE Remote Jobs! | DATA ENTRY + Flexible Schedules | Work From Home Jobs 2026,10K,2 weeks,Real Home Jobs Now Merch Is Available Now! http://realhomejobsnow-shop.fourthwall.com/ Today I'm sharing five no phone ...,22:43.3
/watch?v=f0BHS2i07f0&pp=ygULcmVtb3RlIHdvcms%3D,/@bossfromhome1357,Boss From Home,5 Boring (But Reliable) Remote Jobs That Pay Big | Free Laptop Included + How to Get Hired in 2025,55K,6 months,5 Boring (But Reliable) Remote Jobs That Pay Big | Free Laptop Included + How to Get Hired in 2025 Explore more boring jobs ...,22:43.3
/watch?v=vNygkME5P_Q&pp=ygULcmVtb3RlIHdvcms%3D,/@JustLifeJill,Just Life (Jill),Remote working in BGC ☕️ work-friendly cafe recommendations,422,3 months,"Sharing my four go-to work-friendly coffee shops around BGC, because working from home isn't always productive. ☕️ In ...",22:43.3
/shorts/K3w3WT1qxsk,/@Itswillgriff,Will Griff ,No Interview Remote Jobs (That Are Always Hiring),559K,8 months,"Here's a real list of flexible work-from-home jobs you can start without a resume, a phone call, or experience. Great for busy ...",22:43.3
/shorts/bccpH1UAarw,/@JILLBENDERMW,Jill Bender Magnetic Wealth,Remote Jobs You Can Do At Night With Flexible Schedule🌙 | Make Money Online 🔥💰,700K,2 years,"If you want to start learning how you to start making money with high ticket digital marketing, start with the free training here ...",22:43.3
/watch?v=WXlTadjz0Ro&pp=ygULcmVtb3RlIHdvcms%3D,/@RemoteVee,Remote Vee,How I Got A Remote Job in 48 Hours With NO Experience,56K,1 year,"ABOUT ME Hi, I'm Vee - a full time remote worker & content creator. I share my remote work journey, tips to help you get a remote ...",22:43.3
/watch?v=gXWNE5J3jcI&pp=ygULcmVtb3RlIHdvcms%3D,/@ThePrimeTimeagen,The PrimeTime,Remote Work Is PURE FOOLISHNESS,330K,1 year,"Recorded live on twitch, GET IN ### Article ...",22:43.3
/shorts/r7T0k5QTKj8,/@flexjobs,FlexJobs,WFH Job Search: These 6 Companies That Consistently Have the Most Remote Jobs #wfhjobs #wfh #jobs,294K,1 year,Still struggling to find a remote employer that you love? Here's why…   It's possible that you're not targeting the right types of ...,22:43.3
